{
  "kind": "corint-target-capabilities",
  "contract_version": "1",
  "id": "local-core-example",
  "revision": "1",
  "provenance": {
    "producer": "operator-example",
    "reference": "offline-declaration-not-attested"
  },
  "engine": {
    "name": "corint-decision",
    "version": "0.1.0",
    "profile": "cdl-core-risk-draft-1",
    "language_version": "0.1",
    "capabilities": [
      "rule.score",
      "ruleset.local_score_and_first_match",
      "pipeline.first_match_and_action_intents",
      "pipeline.synchronous_ruleset_router",
      "registry.first_match",
      "expressions.pure_boolean",
      "strict.version_shape_references",
      "input.required_flat_scalars",
      "score.checked_accumulation",
      "pipeline.synchronous_rule_and_subpipeline",
      "pipeline.guards_and_scoped_results",
      "input.optional_closed_objects",
      "expressions.exists_and_checked_arithmetic",
      "runtime.bounded_calls_and_structured_errors",
      "expressions.literal_membership_and_string_matching"
    ]
  },
  "context": {
    "id": "nested-payment-context",
    "revision": "1",
    "sha256": "523a4fcc5b4831fd489271ba153086fe465c778ae2feacf0dd566eb5ceae6e71"
  },
  "status": "ready",
  "actions": [
    "child_only",
    "parent_action"
  ],
  "max_sources": 100,
  "resources": []
}
